{
  "contractVersion": "1.0.0",
  "episodeDate": "2026-07-31",
  "intentId": "fvi-unapproved-source",
  "kind": "source-evidence",
  "sceneIds": ["scene-04"],
  "metrics": [],
  "causalSteps": [],
  "sourceIds": ["source-003"],
  "dataPrecision": "qualitative-only",
  "chartPolicy": "no-series",
  "preferredRecipe": "source-receipt",
  "fallbackRecipe": "news-media",
  "status": "proposed",
  "editorialNote": null
}
